{
  "schema": "zaentrum.library.work/1",
  "id": "0f3cd3cc-270c-511b-8650-c1a9710156ce",
  "rev": 1,
  "createdAt": "2026-09-13T12:00:00Z",
  "createdBy": "example",
  "updatedAt": "2026-09-13T12:00:00Z",
  "updatedBy": "example",
  "kind": "movie",
  "titles": {
    "primary": "Tears of Steel",
    "original": "Tears of Steel",
    "sort": "tears of steel",
    "qualifier": null,
    "localized": {
      "en": {
        "title": "Tears of Steel",
        "sortTitle": "tears of steel",
        "tagline": null,
        "overview": "A group of warriors and scientists gather at the Oude Kerk in Amsterdam to stage a crucial event from the past."
      }
    }
  },
  "year": 2012,
  "releaseDate": "2012-09-26",
  "reference": {
    "runtimeMs": 734000,
    "runtimeSource": "tmdb"
  },
  "externalIds": {
    "tmdbMovie": "133701",
    "imdb": "tt2285752"
  },
  "match": {
    "status": "matched",
    "decidedBy": "tmdb",
    "confidence": 1.0
  },
  "genres": [
    "Science Fiction"
  ],
  "tags": [],
  "rating": 6.0,
  "contentRating": null,
  "credits": [
    {
      "personId": "414c74ea-952c-51f9-9542-ab5098696719",
      "name": "Ian Hubert",
      "role": "director",
      "character": null,
      "order": 0,
      "tmdbPerson": null
    }
  ],
  "artwork": [],
  "collection": null,
  "versions": [
    {
      "id": "f13cfb12-e69b-588c-b10b-a99785850f44",
      "path": "versions/f13cfb12-e69b-588c-b10b-a99785850f44/",
      "label": "Standard · HDR10",
      "primary": true,
      "runtimeMs": 734000,
      "playable": true
    }
  ],
  "curation": {
    "metadataLocked": false,
    "lockedFields": [],
    "notes": null
  },
  "provenance": {
    "migratedFrom": "tmdb",
    "migratedAt": "2026-09-13T12:00:00Z",
    "fieldOrigins": {
      "titles": "tmdb"
    }
  },
  "processing": {
    "package": {
      "status": "done",
      "at": "2026-09-13T12:00:00Z",
      "attempts": 1,
      "error": null
    }
  }
}
