{
  "schema": "zaentrum.library.work/1",
  "id": "60dfb11b-304e-5374-a92d-3fb060bcc16b",
  "rev": 1,
  "createdAt": "2026-09-13T12:00:00Z",
  "createdBy": "example",
  "updatedAt": "2026-09-13T12:00:00Z",
  "updatedBy": "example",
  "kind": "series",
  "titles": {
    "primary": "Example Show",
    "original": null,
    "sort": "example show",
    "qualifier": "US",
    "localized": {}
  },
  "year": 2020,
  "releaseDate": null,
  "reference": {
    "runtimeMs": null,
    "runtimeSource": null
  },
  "externalIds": {},
  "match": {
    "status": "manual",
    "decidedBy": "human",
    "confidence": 1.0,
    "evidence": [
      {
        "signal": "manual",
        "value": "confirmed by a person",
        "weight": 1.0
      }
    ]
  },
  "genres": [],
  "tags": [],
  "rating": null,
  "contentRating": null,
  "credits": [],
  "artwork": [],
  "collection": null,
  "series": {
    "status": "ended",
    "firstAirDate": "2020-01-01",
    "lastAirDate": "2020-03-01",
    "network": null,
    "defaultOrdering": "aired",
    "seasons": [
      {
        "number": 1,
        "name": "Season 1",
        "overview": null,
        "airDate": "2020-01-01",
        "artwork": [],
        "episodes": [
          "c389fac4-32a4-5492-b8d7-17ea7c298f6b"
        ],
        "episodeCountReference": 8
      }
    ],
    "masters": [
      {
        "fingerprint": "hevc/main/8bit/sdr/3840x2080",
        "presentation": "black-and-white sdr",
        "episodes": [
          "c389fac4-32a4-5492-b8d7-17ea7c298f6b"
        ]
      }
    ]
  },
  "versions": [],
  "curation": {
    "metadataLocked": true,
    "lockedFields": [
      "titles"
    ],
    "notes": "title confirmed by hand"
  }
}
